<?xml version="1.0" encoding="utf-8"?>
<imm:IMM-contents xmlns:imm="http://www.saforum.org/IMMSchema" xmlns:xsi="http://www.w3.org/2001/XMLSchema-instance" xsi:noNamespaceSchemaLocation="SAI-AIS-IMM-XSD-A.02.13.xsd">
	<object class="SaAmfApplication">
		<dn>safApp=safImmService</dn>
		<attr>
			<name>saAmfAppType</name>
			<value>safVersion=4.0.0,safAppType=OpenSafApplicationType</value>
		</attr>
	</object>
	<object class="SaAmfCompBaseType">
		<dn>safCompType=OpenSafCompTypeIMMD</dn>
	</object>
	<object class="SaAmfCompType">
		<dn>safVersion=4.0.0,safCompType=OpenSafCompTypeIMMD</dn>
		<attr>
			<name>saAmfCtSwBundle</name>
			<value>safSmfBundle=OpenSAF</value>
		</attr>
		<attr>
			<name>saAmfCtCompCategory</name>
			<value>1</value>
		</attr>
		<attr>
			<name>saAmfCtDefClcCliTimeout</name>
			<value>10000000000</value>
		</attr>
		<attr>
			<name>saAmfCtDefCallbackTimeout</name>
			<value>10000000000</value>
		</attr>
		<attr>
			<name>saAmfCtRelPathInstantiateCmd</name>
			<value>osaf-immd</value>
		</attr>
		<attr>
			<name>saAmfCtDefInstantiateCmdArgv</name>
			<value>instantiate</value>
		</attr>
		<attr>
			<name>saAmfCtRelPathCleanupCmd</name>
			<value>osaf-immd</value>
		</attr>
		<attr>
			<name>saAmfCtDefCleanupCmdArgv</name>
			<value>stop</value>
		</attr>
		<attr>
			<name>saAmfCtDefQuiescingCompleteTimeout</name>
			<value>10000000000</value>
		</attr>
		<attr>
			<name>saAmfCtDefRecoveryOnError</name>
			<value>6</value>
		</attr>
		<attr>
			<name>saAmfCtDefDisableRestart</name>
			<value>1</value>
		</attr>
	</object>
	<object class="SaAmfCompBaseType">
		<dn>safCompType=OpenSafCompTypeIMMND</dn>
	</object>
	<object class="SaAmfCompType">
		<dn>safVersion=4.0.0,safCompType=OpenSafCompTypeIMMND</dn>
		<attr>
			<name>saAmfCtSwBundle</name>
			<value>safSmfBundle=OpenSAF</value>
		</attr>
		<attr>
			<name>saAmfCtCompCategory</name>
			<value>1</value>
		</attr>
		<attr>
			<name>saAmfCtDefClcCliTimeout</name>
			<value>10000000000</value>
		</attr>
		<attr>
			<name>saAmfCtDefCallbackTimeout</name>
			<value>10000000000</value>
		</attr>
		<attr>
			<name>saAmfCtRelPathInstantiateCmd</name>
			<value>osaf-immnd</value>
		</attr>
		<attr>
			<name>saAmfCtDefInstantiateCmdArgv</name>
			<value>instantiate</value>
		</attr>
		<attr>
			<name>saAmfCtRelPathCleanupCmd</name>
			<value>osaf-immnd</value>
		</attr>
		<attr>
			<name>saAmfCtDefCleanupCmdArgv</name>
			<value>stop</value>
		</attr>
		<attr>
			<name>saAmfCtDefQuiescingCompleteTimeout</name>
			<value>10000000000</value>
		</attr>
		<attr>
			<name>saAmfCtDefRecoveryOnError</name>
			<value>2</value>
		</attr>
	</object>
	<object class="SaAmfHealthcheckType">
		<dn>safHealthcheckKey=Default,safVersion=4.0.0,safCompType=OpenSafCompTypeIMMD</dn>
		<attr>
			<name>saAmfHctDefPeriod</name>
			<value>240000000000</value>
		</attr>
		<attr>
			<name>saAmfHctDefMaxDuration</name>
			<value>180000000000</value>
		</attr>
	</object>
	<object class="SaAmfHealthcheckType">
		<dn>safHealthcheckKey=Default,safVersion=4.0.0,safCompType=OpenSafCompTypeIMMND</dn>
		<attr>
			<name>saAmfHctDefPeriod</name>
			<value>240000000000</value>
		</attr>
		<attr>
			<name>saAmfHctDefMaxDuration</name>
			<value>180000000000</value>
		</attr>
	</object>
	<object class="SaAmfCSBaseType">
		<dn>safCSType=IMMD-OpenSAF</dn>
	</object>
	<object class="SaAmfCSType">
		<dn>safVersion=4.0.0,safCSType=IMMD-OpenSAF</dn>
	</object>
	<object class="SaAmfCSI">
		<dn>safCsi=IMMD,safSi=SC-2N,safApp=OpenSAF</dn>
		<attr>
			<name>saAmfCSType</name>
			<value>safVersion=4.0.0,safCSType=IMMD-OpenSAF</value>
		</attr>
	</object>
	<object class="SaAmfSutCompType">
		<dn>safMemberCompType=safVersion=4.0.0\,safCompType=OpenSafCompTypeIMMD,safVersion=4.0.0,safSuType=OpenSafSuTypeServer</dn>
	</object>
	<object class="SaAmfSutCompType">
		<dn>safMemberCompType=safVersion=4.0.0\,safCompType=OpenSafCompTypeIMMND,safVersion=4.0.0,safSuType=OpenSafSuTypeND</dn>
	</object>
	<object class="SaAmfSvcTypeCSTypes">
		<dn>safMemberCSType=safVersion=4.0.0\,safCSType=IMMND-OpenSAF,safVersion=4.0.0,safSvcType=NoRed-OpenSAF</dn>
	</object>
	<object class="SaAmfSvcTypeCSTypes">
		<dn>safMemberCSType=safVersion=4.0.0\,safCSType=IMMD-OpenSAF,safVersion=4.0.0,safSvcType=SC-2N-OpenSAF</dn>
	</object>
	<object class="SaAmfCtCsType">
		<dn>safSupportedCsType=safVersion=4.0.0\,safCSType=IMMD-OpenSAF,safVersion=4.0.0,safCompType=OpenSafCompTypeIMMD</dn>
		<attr>
			<name>saAmfCtCompCapability</name>
			<value>1</value>
		</attr>
	</object>
	<object class="SaAmfCtCsType">
		<dn>safSupportedCsType=safVersion=4.0.0\,safCSType=IMMND-OpenSAF,safVersion=4.0.0,safCompType=OpenSafCompTypeIMMND</dn>
		<attr>
			<name>saAmfCtCompCapability</name>
			<value>1</value>
		</attr>
	</object>
	<object class="SaAmfCSBaseType">
		<dn>safCSType=IMMND-OpenSAF</dn>
	</object>
	<object class="SaAmfCSType">
		<dn>safVersion=4.0.0,safCSType=IMMND-OpenSAF</dn>
	</object>
	<object class="SaImmMngt">
		<dn>safRdn=immManagement,safApp=safImmService</dn>
		<attr>
			<name>saImmRepositoryInit</name>
			<value>2</value>
		</attr>
	</object>
</imm:IMM-contents>
