<?xml version="1.0" encoding="utf-8"?>
<imm:IMM-contents xmlns:imm="http://www.saforum.org/IMMSchema" xmlns:xsi="http://www.w3.org/2001/XMLSchema-instance" xsi:noNamespaceSchemaLocation="SAI-AIS-IMM-XSD-A.02.13.xsd">
	<object class="SaAmfComp">
		<dn>safComp=AMFWDOG,safSu=PL_2_3,safSg=NoRed,safApp=OpenSAF</dn>
		<attr>
			<name>saAmfCompType</name>
			<value>safVersion=4.0.0,safCompType=OpenSafCompTypeAMFWDOG</value>
		</attr>
	</object>
	<object class="SaAmfCSI">
		<dn>safCsi=AMFWDOG,safSi=NoRed_TOKEN,safApp=OpenSAF</dn>
		<attr>
			<name>saAmfCSType</name>
			<value>safVersion=4.0.0,safCSType=AMFWDOG-OpenSAF</value>
		</attr>
	</object>
	<object class="SaAmfCompCsType">
		<dn>safSupportedCsType=safVersion=4.0.0\,safCSType=AMFWDOG-OpenSAF,safComp=AMFWDOG,safSu=PL_2_3,safSg=NoRed,safApp=OpenSAF</dn>
	</object>
</imm:IMM-contents>

