<?xml version="1.0" encoding="utf-8"?>
<imm:IMM-contents xmlns:imm="http://www.saforum.org/IMMSchema" xmlns:xsi="http://www.w3.org/2001/XMLSchema-instance" xsi:noNamespaceSchemaLocation="SAI-AIS-IMM-XSD-A.02.13.xsd">
	<object class="SaClmNode">
                <dn>safNode=CLM_TOKEN,safCluster=myClmCluster</dn>
<!-- By default, no SaClmNode is mapped to SaPlmEE. If this mapping is needed then uncomment the following lines -->
<!--                <attr>
                        <name>saClmNodeEE</name>
                        <value>safEE=PL_2_3,safDomain=domain_1</value>
                </attr>
-->
                <attr>
                        <name>saClmNodeLockCallbackTimeout</name>
                        <value>50000000000</value>
                </attr>
        </object>
	<object class="SaAmfComp">
		<dn>safComp=CLMNA,safSu=PL_2_3,safSg=NoRed,safApp=OpenSAF</dn>
		<attr>
			<name>saAmfCompType</name>
			<value>safVersion=4.0.0,safCompType=OpenSafCompTypeCLMNA</value>
		</attr>
	</object>
	<object class="SaAmfCSI">
		<dn>safCsi=CLMNA,safSi=NoRed_TOKEN,safApp=OpenSAF</dn>
		<attr>
			<name>saAmfCSType</name>
			<value>safVersion=4.0.0,safCSType=CLMNA-OpenSAF</value>
		</attr>
	</object>
	<object class="SaAmfCompCsType">
		<dn>safSupportedCsType=safVersion=4.0.0\,safCSType=CLMNA-OpenSAF,safComp=CLMNA,safSu=PL_2_3,safSg=NoRed,safApp=OpenSAF</dn>
	</object>
</imm:IMM-contents>
