<?xml version="1.0" encoding="utf-8"?>
<imm:IMM-contents xmlns:imm="http://www.saforum.org/IMMSchema" xmlns:xsi="http://www.w3.org/2001/XMLSchema-instance" xsi:noNamespaceSchemaLocation="SAI-AIS-IMM-XSD-A.02.13.xsd">
        <object class="SaAmfComp">
                <dn>safComp=PLMS,safSu=SC_2_1,safSg=2N,safApp=OpenSAF</dn>
                <attr>
                        <name>saAmfCompType</name>
                        <value>safVersion=4.0.0,safCompType=OpenSafCompTypePLMS</value>
                </attr>
        </object>
        <object class="SaAmfCompCsType">
                <dn>safSupportedCsType=safVersion=4.0.0\,safCSType=PLMS-OpenSAF,safComp=PLMS,safSu=SC_2_1,safSg=2N,safApp=OpenSAF</dn>
        </object>
	<object class="SaPlmEE">
		<dn>safEE=SC_2_1,safDomain=domain_1</dn> 
		<attr>
			<name>saPlmEEType</name> 
			<value>safVersion=1,safEEType=Linux_os</value> 
		</attr>
		<attr>
			<name>saPlmEEInstantiateTimeout</name> 
			<value>180000000000</value> 
		</attr>
		<attr>
			<name>saPlmEETerminateTimeout</name> 
			<value>180000000000</value> 
		</attr>
	</object>
</imm:IMM-contents>
