<?xml version="1.0" encoding="utf-8"?>
<imm:IMM-contents xmlns:imm="http://www.saforum.org/IMMSchema" xmlns:xsi="http://www.w3.org/2001/XMLSchema-instance" xsi:noNamespaceSchemaLocation="SAI-AIS-IMM-XSD-A.02.13.xsd">
	<class name="OpensafConfig">
		<category>SA_CONFIG</category>
		<rdn>
			<name>opensafConfigId</name>
			<type>SA_STRING_T</type>
			<category>SA_CONFIG</category>
			<flag>SA_INITIALIZED</flag>
		</rdn>
		<attr>
			<name>opensafNetworkName</name>
			<type>SA_STRING_T</type>
			<category>SA_CONFIG</category>
			<flag>SA_WRITABLE</flag>
		</attr>
	</class>
</imm:IMM-contents>
