<?xml version="1.0" encoding="utf-8"?>
<imm:IMM-contents xmlns:imm="http://www.saforum.org/IMMSchema" xmlns:xsi="http://www.w3.org/2001/XMLSchema-instance" xsi:noNamespaceSchemaLocation="SAI-AIS-IMM-XSD-A.02.13.xsd">
	<class name="SaLckResource">
		<category>SA_RUNTIME</category>
		<rdn>
			<name>safLock</name>
			<type>SA_STRING_T</type>
			<category>SA_RUNTIME</category>
			<flag>SA_CACHED</flag>
		</rdn>
		<attr>
			<name>saLckResourceCreationTimestamp</name>
			<type>SA_TIME_T</type>
			<category>SA_RUNTIME</category>
			<flag>SA_CACHED</flag>
		</attr>
		<attr>
			<name>saLckResourceNumOpeners</name>
			<type>SA_UINT32_T</type>
			<category>SA_RUNTIME</category>
		</attr>
		<attr>
			<name>saLckResourceIsOrphaned</name>
			<type>SA_UINT32_T</type>
			<category>SA_RUNTIME</category>
		</attr>
		<attr>
			<name>saLckResourceStrippedCount</name>
			<type>SA_UINT32_T</type>
			<category>SA_RUNTIME</category>
		</attr>
	</class>
</imm:IMM-contents>
