<?xml version="1.0" encoding="utf-8"?>
<imm:IMM-contents xmlns:imm="http://www.saforum.org/IMMSchema" xmlns:xsi="http://www.w3.org/2001/XMLSchema-instance" xsi:noNamespaceSchemaLocation="SAI-AIS-IMM-XSD-A.02.13.xsd">
	<class name="SaClmNode">
                <category>SA_CONFIG</category>
                <rdn>
                        <name>safNode</name>
                        <type>SA_STRING_T</type>
                        <category>SA_CONFIG</category>
                        <flag>SA_INITIALIZED</flag>
                </rdn>
                <attr>
                        <name>saClmNodeDisableReboot</name>
                        <type>SA_UINT32_T</type>
                        <category>SA_CONFIG</category>
                        <flag>SA_WRITABLE</flag>
                        <default-value>0</default-value>
                </attr>
                <attr>
                        <name>saClmNodeEE</name>
                        <type>SA_NAME_T</type>
                        <category>SA_CONFIG</category>
                        <flag>SA_WRITABLE</flag>
                </attr>
                <attr>
                        <name>saClmNodeAddressFamily</name>
                        <type>SA_UINT32_T</type>
                        <category>SA_CONFIG</category>
                        <flag>SA_WRITABLE</flag>
                </attr>
                <attr>
                        <name>saClmNodeAddress</name>
                        <type>SA_STRING_T</type>
                        <category>SA_CONFIG</category>
                        <flag>SA_WRITABLE</flag>
                </attr>
		<attr>
                        <name>saClmNodeLockCallbackTimeout</name>
                        <type>SA_TIME_T</type>
                        <category>SA_CONFIG</category>
                        <flag>SA_WRITABLE</flag>
                </attr>
                <attr>
                        <name>saClmNodeID</name>
                        <type>SA_UINT32_T</type>
                        <category>SA_RUNTIME</category>
                        <flag>SA_CACHED</flag>
                </attr>
                <attr>
                        <name>saClmNodeIsMember</name>
                        <type>SA_UINT32_T</type>
                        <category>SA_RUNTIME</category>
                        <flag>SA_CACHED</flag>
                </attr>
                <attr>
                        <name>saClmNodeBootTimeStamp</name>
                        <type>SA_TIME_T</type>
                        <category>SA_RUNTIME</category>
                        <flag>SA_CACHED</flag>
                </attr>
                <attr>
                        <name>saClmNodeInitialViewNumber</name>
                        <type>SA_UINT64_T</type>
                        <category>SA_RUNTIME</category>
                        <flag>SA_CACHED</flag>
                </attr>
                <attr>
                        <name>saClmNodeCurrAddressFamily</name>
                        <type>SA_UINT32_T</type>
                        <category>SA_RUNTIME</category>
                        <flag>SA_CACHED</flag>
                </attr>
                <attr>
                        <name>saClmNodeCurrAddress</name>
                        <type>SA_STRING_T</type>
                        <category>SA_RUNTIME</category>
                        <flag>SA_CACHED</flag>
                </attr>
                <attr>
                        <name>saClmNodeAdminState</name>
                        <type>SA_UINT32_T</type>
                        <category>SA_RUNTIME</category>
                        <flag>SA_PERSISTENT</flag>
                        <flag>SA_CACHED</flag>
                        <default-value>1</default-value>
                </attr>
        </class>
	
	<class name="SaClmCluster">
                <category>SA_CONFIG</category>
                <rdn>
                        <name>safCluster</name>
                        <type>SA_STRING_T</type>
                        <category>SA_CONFIG</category>
                        <flag>SA_INITIALIZED</flag>
                </rdn>
                <attr>
                        <name>saClmClusterNumNodes</name>
                        <type>SA_UINT32_T</type>
                        <category>SA_RUNTIME</category>
                        <flag>SA_CACHED</flag>
                </attr>
                <attr>
                        <name>saClmClusterInitTimestamp</name>
                        <type>SA_TIME_T</type>
                        <category>SA_RUNTIME</category>
                        <flag>SA_CACHED</flag>
                </attr>
        </class>

</imm:IMM-contents>
