<?xml version="1.0" encoding="utf-8"?>
<imm:IMM-contents xmlns:imm="http://www.saforum.org/IMMSchema" xmlns:xsi="http://www.w3.org/2001/XMLSchema-instance" xsi:noNamespaceSchemaLocation="SAI-AIS-IMM-XSD-A.02.13.xsd">
	<class name="SaCkptCheckpoint">
		<category>SA_RUNTIME</category>
		<rdn>
			<name>safCkpt</name>
			<type>SA_STRING_T</type>
			<category>SA_RUNTIME</category>
			<flag>SA_CACHED</flag>
		</rdn>
		<attr>
			<name>saCkptCheckpointCreationTimestamp</name>
			<type>SA_TIME_T</type>
			<category>SA_RUNTIME</category>
			<flag>SA_CACHED</flag>
		</attr>
		<attr>
			<name>saCkptCheckpointSize</name>
			<type>SA_UINT64_T</type>
			<category>SA_RUNTIME</category>
		</attr>
		<attr>
			<name>saCkptCheckpointUsedSize</name>
			<type>SA_UINT64_T</type>
			<category>SA_RUNTIME</category>
		</attr>
		<attr>
			<name>saCkptCheckpointCreationFlags</name>
			<type>SA_UINT32_T</type>
			<category>SA_RUNTIME</category>
			<flag>SA_CACHED</flag>
		</attr>
		<attr>
			<name>saCkptCheckpointRetDuration</name>
			<type>SA_TIME_T</type>
			<category>SA_RUNTIME</category>
		</attr>
		<attr>
			<name>saCkptCheckpointMaxSections</name>
			<type>SA_UINT32_T</type>
			<category>SA_RUNTIME</category>
			<flag>SA_CACHED</flag>
		</attr>
		<attr>
			<name>saCkptCheckpointMaxSectionSize</name>
			<type>SA_UINT64_T</type>
			<category>SA_RUNTIME</category>
			<flag>SA_CACHED</flag>
		</attr>
		<attr>
			<name>saCkptCheckpointMaxSectionIdSize</name>
			<type>SA_UINT64_T</type>
			<category>SA_RUNTIME</category>
			<flag>SA_CACHED</flag>
		</attr>
		<attr>
			<name>saCkptCheckpointNumOpeners</name>
			<type>SA_UINT32_T</type>
			<category>SA_RUNTIME</category>
		</attr>
		<attr>
			<name>saCkptCheckpointNumReaders</name>
			<type>SA_UINT32_T</type>
			<category>SA_RUNTIME</category>
		</attr>
		<attr>
			<name>saCkptCheckpointNumWriters</name>
			<type>SA_UINT32_T</type>
			<category>SA_RUNTIME</category>
		</attr>
		<attr>
			<name>saCkptCheckpointNumReplicas</name>
			<type>SA_UINT32_T</type>
			<category>SA_RUNTIME</category>
		</attr>
		<attr>
			<name>saCkptCheckpointNumSections</name>
			<type>SA_UINT32_T</type>
			<category>SA_RUNTIME</category>
		</attr>
		<attr>
			<name>saCkptCheckpointNumCorruptSections</name>
			<type>SA_UINT32_T</type>
			<category>SA_RUNTIME</category>
		</attr>
	</class>
	<class name="SaCkptReplica">
		<category>SA_RUNTIME</category>
		<rdn>
			<name>safReplica</name>
			<type>SA_NAME_T</type>
			<category>SA_RUNTIME</category>
			<flag>SA_CACHED</flag>
		</rdn>
		<attr>
			<name>saCkptReplicaIsActive</name>
			<type>SA_UINT32_T</type>
			<category>SA_RUNTIME</category>
		</attr>
	</class>
</imm:IMM-contents>
