<?xml version="1.0" encoding="utf-8"?>
<imm:IMM-contents xmlns:imm="http://www.saforum.org/IMMSchema" xmlns:xsi="http://www.w3.org/2001/XMLSchema-instance" xsi:noNamespaceSchemaLocation="SAI-AIS-IMM-XSD-A.02.13.xsd">
	<object class="SaAmfComp">
		<dn>safComp=MQD,safSu=SC_2_1,safSg=2N,safApp=OpenSAF</dn>
		<attr>
			<name>saAmfCompType</name>
			<value>safVersion=4.0.0,safCompType=OpenSafCompTypeMQD</value>
		</attr>
	</object>
	<object class="SaAmfCompCsType">
		<dn>safSupportedCsType=safVersion=4.0.0\,safCSType=MQD-OpenSAF,safComp=MQD,safSu=SC_2_1,safSg=2N,safApp=OpenSAF</dn>
	</object>
	<object class="SaAmfComp">
		<dn>safComp=MQND,safSu=SC_2_1,safSg=NoRed,safApp=OpenSAF</dn>
		<attr>
			<name>saAmfCompType</name>
			<value>safVersion=4.0.0,safCompType=OpenSafCompTypeMQND</value>
		</attr>
	</object>
	<object class="SaAmfCSI">
		<dn>safCsi=MQND,safSi=NoRed_TOKEN,safApp=OpenSAF</dn>
		<attr>
			<name>saAmfCSType</name>
			<value>safVersion=4.0.0,safCSType=MQND-OpenSAF</value>
		</attr>
	</object>
	<object class="SaAmfCompCsType">
		<dn>safSupportedCsType=safVersion=4.0.0\,safCSType=MQND-OpenSAF,safComp=MQND,safSu=SC_2_1,safSg=NoRed,safApp=OpenSAF</dn>
	</object>
</imm:IMM-contents>
