<?xml version="1.0" encoding="utf-8"?>
<imm:IMM-contents xmlns:imm="http://www.saforum.org/IMMSchema" xmlns:xsi="http://www.w3.org/2001/XMLSchema-instance" xsi:noNamespaceSchemaLocation="SAI-AIS-IMM-XSD-A.02.13.xsd">
	<class name="SaLogStream">
		<category>SA_RUNTIME</category>
		<rdn>
			<name>safLgStr</name>
			<type>SA_STRING_T</type>
			<category>SA_RUNTIME</category>
			<flag>SA_CACHED</flag>
		</rdn>
		<attr>
			<name>saLogStreamFileName</name>
			<type>SA_STRING_T</type>
			<category>SA_RUNTIME</category>
			<flag>SA_CACHED</flag>
		</attr>
		<attr>
			<name>saLogStreamPathName</name>
			<type>SA_STRING_T</type>
			<category>SA_RUNTIME</category>
			<flag>SA_CACHED</flag>
		</attr>
		<attr>
			<name>saLogStreamMaxLogFileSize</name>
			<type>SA_UINT64_T</type>
			<category>SA_RUNTIME</category>
			<flag>SA_CACHED</flag>
		</attr>
		<attr>
			<name>saLogStreamFixedLogRecordSize</name>
			<type>SA_UINT32_T</type>
			<category>SA_RUNTIME</category>
			<flag>SA_CACHED</flag>
		</attr>
		<attr>
			<name>saLogStreamHaProperty</name>
			<type>SA_UINT32_T</type>
			<category>SA_RUNTIME</category>
			<flag>SA_CACHED</flag>
			</attr>
		<attr>
			<name>saLogStreamLogFullAction</name>
			<type>SA_UINT32_T</type>
			<category>SA_RUNTIME</category>
			<flag>SA_CACHED</flag>
		</attr>
		<attr>
			<name>saLogStreamMaxFilesRotated</name>
			<type>SA_UINT32_T</type>
			<category>SA_RUNTIME</category>
			<flag>SA_CACHED</flag>
		</attr>
		<attr>
			<name>saLogStreamLogFileFormat</name>
			<type>SA_STRING_T</type>
			<category>SA_RUNTIME</category>
			<flag>SA_CACHED</flag>
		</attr>
		<attr>
			<name>saLogStreamSeverityFilter</name>
			<type>SA_UINT32_T</type>
			<category>SA_RUNTIME</category>
			<flag>SA_CACHED</flag>
		</attr>
		<attr>
			<name>saLogStreamCreationTimestamp</name>
			<type>SA_TIME_T</type>
			<category>SA_RUNTIME</category>
			<flag>SA_CACHED</flag>
		</attr>
		<attr>
			<name>saLogStreamNumOpeners</name>
			<type>SA_UINT32_T</type>
			<category>SA_RUNTIME</category>
		</attr>
		<attr>
			<name>logStreamDiscardedCounter</name>
			<type>SA_UINT64_T</type>
			<category>SA_RUNTIME</category>
		</attr>
	</class>
	<class name="SaLogStreamConfig">
		<category>SA_CONFIG</category>
		<rdn>
			<name>safLgStrCfg</name>
			<type>SA_STRING_T</type>
			<category>SA_CONFIG</category>
			<flag>SA_INITIALIZED</flag>
		</rdn>
		<attr>
			<name>saLogStreamFileName</name>
			<type>SA_STRING_T</type>
			<category>SA_CONFIG</category>
			<flag>SA_INITIALIZED</flag>
			<flag>SA_WRITABLE</flag>
		</attr>
		<attr>
			<name>saLogStreamPathName</name>
			<type>SA_STRING_T</type>
			<category>SA_CONFIG</category>
			<flag>SA_INITIALIZED</flag>
		</attr>
		<attr>
			<name>saLogStreamMaxLogFileSize</name>
			<type>SA_UINT64_T</type>
			<category>SA_CONFIG</category>
			<flag>SA_WRITABLE</flag>
			<default-value>5000000</default-value>
		</attr>
		<attr>
			<name>saLogStreamFixedLogRecordSize</name>
			<type>SA_UINT32_T</type>
			<category>SA_CONFIG</category>
			<flag>SA_WRITABLE</flag>
			<default-value>150</default-value>
		</attr>
		<attr>
			<name>saLogStreamLogFullAction</name>
			<type>SA_UINT32_T</type>
			<category>SA_CONFIG</category>
			<flag>SA_WRITABLE</flag>
			<default-value>3</default-value>
		</attr>
		<attr>
			<name>saLogStreamLogFullHaltThreshold</name>
			<type>SA_UINT32_T</type>
			<category>SA_CONFIG</category>
			<flag>SA_WRITABLE</flag>
			<default-value>75</default-value>
		</attr>
		<attr>
			<name>saLogStreamMaxFilesRotated</name>
			<type>SA_UINT32_T</type>
			<category>SA_CONFIG</category>
			<flag>SA_WRITABLE</flag>
			<default-value>4</default-value>
		</attr>
		<attr>
			<name>saLogStreamLogFileFormat</name>
			<type>SA_STRING_T</type>
			<category>SA_CONFIG</category>
			<flag>SA_WRITABLE</flag>
		</attr>
		<attr>
			<name>saLogStreamSeverityFilter</name>
			<type>SA_UINT32_T</type>
			<category>SA_CONFIG</category>
			<flag>SA_WRITABLE</flag>
		</attr>
		<attr>
			<name>saLogStreamCreationTimestamp</name>
			<type>SA_TIME_T</type>
			<category>SA_RUNTIME</category>
			<flag>SA_CACHED</flag>
		</attr>
		<attr>
			<name>saLogStreamNumOpeners</name>
			<type>SA_UINT32_T</type>
			<category>SA_RUNTIME</category>
		</attr>
		<attr>
			<name>logStreamDiscardedCounter</name>
			<type>SA_UINT64_T</type>
			<category>SA_RUNTIME</category>
		</attr>
	</class>
	<class name="OpenSafLogConfig">
<!-- Care is needed when changing to the default values for the attributes of this class
to ensure that default global values in the implementation are also changed accordingly.
--> 
		<category>SA_CONFIG</category>
		<rdn>
			<name>logConfig</name>
			<type>SA_STRING_T</type>
			<category>SA_CONFIG</category>
			<flag>SA_INITIALIZED</flag>
		</rdn>
		<attr>
			<name>logRootDirectory</name>
			<type>SA_STRING_T</type>
			<category>SA_CONFIG</category>
			<flag>SA_INITIALIZED</flag>
			<flag>SA_WRITABLE</flag>
		</attr>
		<attr>
			<name>logMaxLogrecsize</name>
			<type>SA_UINT32_T</type>
			<category>SA_CONFIG</category>
			<flag>SA_WRITABLE</flag>
            <default-value>1024</default-value>
		</attr>
		<attr>
			<name>logStreamFileFormat</name>
			<type>SA_STRING_T</type>
			<category>SA_CONFIG</category>
			<flag>SA_WRITABLE</flag>
		</attr>
		<attr>
			<name>logStreamSystemHighLimit</name>
			<type>SA_UINT32_T</type>
			<category>SA_CONFIG</category>
			<flag>SA_WRITABLE</flag>
            <default-value>0</default-value>
		</attr>
		<attr>
			<name>logStreamSystemLowLimit</name>
			<type>SA_UINT32_T</type>
			<category>SA_CONFIG</category>
			<flag>SA_WRITABLE</flag>
            <default-value>0</default-value>
		</attr>
		<attr>
			<name>logStreamAppHighLimit</name>
			<type>SA_UINT32_T</type>
			<category>SA_CONFIG</category>
			<flag>SA_WRITABLE</flag>
            <default-value>0</default-value>
		</attr>
		<attr>
			<name>logStreamAppLowLimit</name>
			<type>SA_UINT32_T</type>
			<category>SA_CONFIG</category>
			<flag>SA_WRITABLE</flag>
            <default-value>0</default-value>
		</attr>
		<attr>
			<name>logMaxApplicationStreams</name>
			<type>SA_UINT32_T</type>
			<category>SA_CONFIG</category>
			<flag>SA_WRITABLE</flag>
            <default-value>64</default-value>
		</attr>
		<attr>
			<name>logFileIoTimeout</name>
			<type>SA_UINT32_T</type>
			<category>SA_CONFIG</category>
			<flag>SA_WRITABLE</flag>
            <default-value>500</default-value>
		</attr>
		<attr>
			<name>logFileSysConfig</name>
			<type>SA_UINT32_T</type>
			<category>SA_CONFIG</category>
			<flag>SA_WRITABLE</flag>
			<default-value>1</default-value>
		</attr>
		<attr>
			<name>logDataGroupname</name>
			<type>SA_STRING_T</type>
			<category>SA_CONFIG</category>
			<flag>SA_WRITABLE</flag>
		</attr>
	</class>
	<class name="OpenSafLogCurrentConfig">
		<category>SA_RUNTIME</category>
		<rdn>
			<name>logConfig</name>
			<type>SA_STRING_T</type>
			<category>SA_RUNTIME</category>
			<flag>SA_CACHED</flag>
		</rdn>
		<attr>
			<name>logRootDirectory</name>
			<type>SA_STRING_T</type>
			<category>SA_RUNTIME</category>
		</attr>
		<attr>
			<name>logMaxLogrecsize</name>
			<type>SA_UINT32_T</type>
			<category>SA_RUNTIME</category>
		</attr>
		<attr>
			<name>logStreamFileFormat</name>
			<type>SA_STRING_T</type>
			<category>SA_RUNTIME</category>
		</attr>
		<attr>
			<name>logStreamSystemHighLimit</name>
			<type>SA_UINT32_T</type>
			<category>SA_RUNTIME</category>
		</attr>
		<attr>
			<name>logStreamSystemLowLimit</name>
			<type>SA_UINT32_T</type>
			<category>SA_RUNTIME</category>
		</attr>
		<attr>
			<name>logStreamAppHighLimit</name>
			<type>SA_UINT32_T</type>
			<category>SA_RUNTIME</category>
		</attr>
		<attr>
			<name>logStreamAppLowLimit</name>
			<type>SA_UINT32_T</type>
			<category>SA_RUNTIME</category>
		</attr>
		<attr>
			<name>logMaxApplicationStreams</name>
			<type>SA_UINT32_T</type>
			<category>SA_RUNTIME</category>
		</attr>
		<attr>
			<name>logFileIoTimeout</name>
			<type>SA_UINT32_T</type>
			<category>SA_RUNTIME</category>
		</attr>
		<attr>
			<name>logFileSysConfig</name>
			<type>SA_UINT32_T</type>
			<category>SA_RUNTIME</category>
		</attr>
		<attr>
			<name>logDataGroupname</name>
			<type>SA_STRING_T</type>
			<category>SA_RUNTIME</category>
		</attr>
	</class>
</imm:IMM-contents>
